{
  "id": "example-producer:DecisionHandoff:no-go",
  "type": "DecisionHandoff",
  "producer": "release-readiness",
  "protocol_version": "1.0",
  "subject": "example.com pricing page",
  "as_of": "2026-09-08T12:00:00Z",
  "confidence": "high",
  "dependencies": [
    "example-producer:FindingEnvelope:conformance"
  ],
  "payload": {
    "verdict": "NO_GO",
    "blockers": [
      "checkout returns 500 for EUR"
    ],
    "controls": [],
    "release_candidate": "v1.4.0-rc.2",
    "environment": "production"
  }
}
